{
  "schema_version": "1.0.0",
  "report_id": "88888888-8888-4888-8888-888888888888",
  "project_id": "11111111-1111-4111-8111-111111111111",
  "generation_id": "99999999-9999-4999-8999-999999999999",
  "input_hash": "e9180195c21c66d63d76c5a843e577f81ff19726a24c6fabf47bcf137cdba590",
  "validator_version": "0.1.0",
  "created_at": "2026-09-14T12:01:00Z",
  "status": "failed",
  "method_validation_status": "experimental",
  "issues": [
    {
      "code": "SEAM_LENGTH_MISMATCH",
      "severity": "blocking_error",
      "message_ru": "Длины боковых швов юбки не совпадают.",
      "json_pointer": "/pattern/pieces/0",
      "piece_id": "skirt_front",
      "formula_id": null,
      "measured_value": 10.066,
      "limit_value": 1.0,
      "unit": "mm"
    }
  ],
  "checks": [
    {
      "id": "seams.side",
      "status": "failed",
      "message_ru": "Остаток превышает допуск 1 мм.",
      "measured_value": 10.066,
      "limit_value": 1.0,
      "unit": "mm"
    }
  ],
  "diagnostic_export_allowed": false,
  "production_export_allowed": false
}
